"1378","1-1378","深圳市","440300","深圳南国艺恒国际影城坂田店","深圳市龙岗区坂田街道吉华路999号坂田商业广场5楼","","电影院","250","22.63962","114.06865","35","0","null","","0","乘300路、313路、317路、328路、333路、335路、339路、378路、380路B、616路、662路、839路、981路到【坂田市场】站下车。41","　　南国艺恒国际影城地处龙岗区坂田街道吉华路999号，坐落于集餐饮娱乐休闲购物为一体的坂田商业广场。影城总投资3000多万元，坐拥10个豪华观影厅，占地面积5500多平米，可容纳1059人同时观影，是按五星级标准打造的现代化多功能豪华影城。<br/><br/>　　特色：<br/>　　品牌连锁，再结新硕果<br/>　　国内知名影院管理品牌――新南国管理品牌深圳第四家战略布局，开启深圳关外地区五星娱乐新视界！<br/><br/>　　巨资营造梦幻影院氛围<br/>　　置身其中自己做“主角”：南国艺恒国际影城以紫色、黑色为主色调，配合以变幻的七彩灯光，融时尚高雅与温情浪漫与一体；<br/><br/>　　国际级最新放映设备<br/>　　畅享超高清视听盛宴：国际最新的一流放映设备和音响设备，让您可以舒心地畅享五星级超高清视听盛宴！<br/><br/>　　礼宾式服务，宾至如归：南国艺恒国际影城推崇高标准的礼宾式服务。影城以“微笑和温馨”为服务理念，从细节着手，为客户带来体贴入微的舒适；<br/><br/>　　10个豪华影厅&nbsp;&nbsp;1059个进口座椅严正以待&nbsp;&nbsp;观影“零等待”：南国艺恒国际影城拥有10个豪华观影厅，是深圳影厅最多的影城之一，排片组合众多，可任意选择，1059个进口座椅确保您舒适观影“零等待”！<br/><br/>　　网址：http://www.clcineplex.com/[A%#]3D眼睛无需押金[A%#][A%#]提供800个泊车位，凭电影票免费泊车3小时。[A%#][A%#]肯德基[A%#][A%#][A%#]",,"http://img.wangpiao.com/NewsImage/20132/17a52dda-0287-4f00-becd-56323619702f.jpg","Http://www.wangpiao.com/cinema/1330/"
"1197","1-1197","重庆市","500000","17.5影城重庆解放碑店","重庆市渝中区临江路89号女人广场3楼 ","","电影院","250","29.56380","106.57972","42","0","null","","0","13,14","17.5重庆解放碑广场影城坐落于临江门女人广场3楼。是时代今典集团旗下“17.5影城”全国第61家，重庆第3家影院。&nbsp;影城占地2500余平方米，共设6个豪华放映厅，755个座位可供选择，特设3D放映设备满足您全新视听享受。&nbsp;视听超震撼、观影新体验！[A%#]进口3D设备，满足您试听新要求[A%#][A%#]天伦华苑收费停车场[A%#]欢乐迪KTV[A%#]乡村基，和之吉川菜酒楼[A%#][A%#][A%#]",,"http://img.wangpiao.com/NewsImage/20132/04eb7020-b81f-4a1a-9667-9093bea7db2e.jpg","Http://www.wangpiao.com/cinema/348/"
"1219","1-1219","北京市","110000","北京地质礼堂","北京市西城区西四羊肉胡同三十号 ","","电影院","250","39.92877","116.37799","4","0","null","","0","公交车：22 47 603 604 109 13 42 105 102 103 626 124到西四 地铁四号线到西四出Ｄ口即到4","北京地质礼堂位于北京市西城区西四羊肉胡同三十号。总面积五千平方米,是集四个电影厅、歌厅、网吧、地质广告等经营项目为一体的综合性文化娱乐场所。其中电影一厅可容纳千人能承接大型会议及演出。&nbsp;地质礼堂在2007年通过了ISO9000质量认证。礼堂本着:“创一流服务”的宗旨,为广大观众提供优质的服务。[A%#]三厅和四厅均是3D厅。 [A%#][A%#]免费停车。[A%#]比邻地质博物馆，万通商城，天意批发，华联商场等。[A%#]大三元，仿膳饭庄，护国寺小吃店，庆丰包子铺，女儿红酒楼，砂锅居等多家老字号，还有西四肯德基。[A%#][A%#][A%#]",,"http://Img.wangpiao.com/NewsImage/20135/cc909037-611e-4718-afe3-f2f46bf1bea9.jpg","Http://www.wangpiao.com/cinema/102/"
"1220","1-1220","北京市","110000","万达国际影城天通苑店","北京市昌平区立汤路186号龙德广场五层 ","","电影院","250","40.06730","116.42177","32","0","null","","0","地铁5号线天通苑南站，地铁13号线立水桥站；公交426,464,985,417,984,751,966,358,643,465,7583,5","万达国际电影城（龙德店）位于天通苑区域龙德广场五层，是目前京城容量最大、影城设计最为独特的国际高标准影城，设置9个豪华影厅，其中包含一个VIP影厅，1798个座位，规模超过了北京最大的万达国际电影城（国贸店），刷新了京城影院纪录。影城的开业，也标志着万达电影院线全国直接投资银幕数量达到了200块，同样刷新了电影行业纪录！&nbsp;现代人越来越注重时尚、品味的优质生活，万达龙德国际电影城无论从硬件设施还是软件服务都全力打造“顶级影城”，会给每一位观众带来绝对舒适、豪华、震撼的观影体验。影城影厅空间宏大，厅内高度均超[A%#]无押金[A%#]6号厅为IMAX厅[A%#][A%#][A%#][A%#][A%#]每周一、三、五12:00前观影半价优惠。[A%#]",,"http://img.wangpiao.com/NewsImage/20132/1d135267-6236-4a55-9f1c-de49d6527004.jpg","Http://www.wangpiao.com/cinema/81/"
"1221","1-1221","北京市","110000","北京市工人俱乐部","北京西城区两广路虎坊桥十字路口向南50米马路西侧","","电影院","250","39.89438","116.39100","4","0","null","","0","5、6、7、14、15、23、34、57、66、70、102、715、特5、743、等路虎坊桥下车。开车至两广路虎坊桥十字路口向南50米马路西侧。4","　　影院地处宣武区虎坊路七号，一直以来为繁荣首都文艺舞台，丰富人民群众的文化生活，发挥了重要作用。这里曾接待过国际及国内许多文化艺术团体的大型演出活动：朝鲜艺术团和意大利著名高音歌唱家帕瓦罗底都曾在此献艺；国内著名文艺团体如东方歌舞团、中国交响乐团等也曾在这里演出过。<br/>&nbsp;&nbsp;&nbsp;&nbsp;近年来，北京市工人俱乐部电影城进行了较大规模的综合整修，拓展了电影放映业务，与新影联合作，建立虎坊桥影城，整个影城由三个共计239座的多功能豪华小影厅和一个1150座的综合厅组成，均是按现代影院标准设置：高起坡、低视角、宽银幕，并配置有先进的西班牙产JBL数码立体声扬声器和Dolby处理器等放映设备，有着细致入微、逼真的还原音响效果，可以让您领略到惊天动地、排山倒海般的震撼力！影厅座椅采用高靠背、大宽度的新型电影座椅，让您在观看电影时有一个宽大舒适的个人空间。<br/>&nbsp;&nbsp;&nbsp;&nbsp;北京市工人俱乐部电影城除主营电影业务外还可接待文艺演出、大中小型会议及各种庆典活动等。北京市工人俱乐部影城优雅的环境以及练歌房、台球城、餐厅都会使您留恋忘返。<br/>&nbsp;&nbsp;&nbsp;&nbsp;北京市工人俱乐部电影城除了极佳的放映设备外，最具人性化的服务才是您最大的精神享受。优质的服务、高素质的工作人员队伍，会让您有种到家的感觉，充分享受电影给您带来的乐趣，让您心情更加放松、愉快。纷繁复杂的生活使您身心疲惫，我们这里可以让您身心愉悦并得到升华和净化。[A%#][A%#][A%#]收费停车[A%#][A%#][A%#][A%#][A%#]",,"http://img.wangpiao.com/NewsImage/20132/d4de7f19-ee34-4996-980d-a25305797711.jpg","Http://www.wangpiao.com/cinema/108/"
"1202","1-1202","北京市","110000","美嘉欢乐影城三里屯店","北京市朝阳区三里屯北路19号Village地下一层（三里屯酒吧街南口西侧） ","","电影院","250","39.94045","116.46132","1","0","null","","0","三里屯站下车：113、115、406、416、431、701、758 6","美嘉贴心，所以欢乐！<br/>能提前一天购票：储值会员更可享受在线选作购票，线下轻松取票免去排队烦恼。<br/>不无理限制外带食品和饮料：为什么要禁止您带食品和饮料呢？在美嘉，除了影响他人看电影的瓜子和汉堡等不让带，其他的您随意。我们对我们爆米花的味道和套餐价格优惠充满信心！您不想来试试吗？<br/>欢迎退票：美嘉人性化服务的重要组成部分，在您朋友不能按时赶来的时候，我们实在想不出理由对您退票的愿望说“No”！美嘉相信，您要退票一定有您不得已的理由，只要您是全额购票，在开映半小时以上，请来客服中心吧！<br/>音响效果超好：尤其是我们的VIP大厅，和奥斯卡颁奖礼用的一样的音响系统，没办法，我们和您一样，信赖专业！[A%#]3D眼镜免押金[A%#][A%#]按照“P”的标志找到停车场；一张票根换一张免费停车[A%#][A%#][A%#][A%#]非会员每周二半价[A%#]1.2m以下儿童免票无座，1.2m以上儿童需购买学生票",,"http://img.wangpiao.com/NewsImage/20132/02f4e7f5-c06c-4032-b607-07c06196accf.jpg","Http://www.wangpiao.com/cinema/44/"
"1205","1-1205","北京市","110000","万达国际影城CBD店","北京市朝阳区建国路93号万达广场三层","","电影院","250","39.91450","116.47740","1","0","null","","0","公交车1、57等路在郎家园下车；地铁1号线大望路下车，往西走500米。1,6","　　北京万达国际电影城是由国内知名企业大连万达集团投巨资建立的超五星级标准电影城。大连万达集团是目前中国极具规模和实力的商业地产企业之一，它在国内各大城市均拥有商业购物广场。万达国际电影城作为各地万达商业广场内的固定业态之一，开辟了我国电影产业链终端产品的全新经营模式。国际级现代化多厅影城，显示了万达集团高层对中国电影市场定位及把握的准确性，进一步提升了万达在国内外的品牌价值。万达电影院位于北京市中央商务区核心地段的北京万达广场项目内，紧邻东三环和国贸中心，总建筑面积达6000多平方米。设置9个厅，共计150[A%#]无押金[A%#]8号IMAX厅有359个座位[A%#][A%#][A%#][A%#][A%#][A%#]",,"http://img.wangpiao.com/NewsImage/20132/28595b01-b07d-4f1f-9bb2-97295070c49c.jpg","Http://www.wangpiao.com/cinema/64/"
"1272","1-1272","成都市","510100","17.5影城今典沙湾店","成都市金牛区沙湾路1号汇龙湾广场3楼(卜蜂莲花3楼) ","","电影院","250","30.69110","104.05897","205","0","null","","0","","[A%#][A%#][A%#][A%#][A%#][A%#][A%#][A%#]",,"http://img.wangpiao.com/NewsImage/20132/c4cc672d-cab9-49a3-a3fe-cb71a21c9ecf.jpg","Http://www.wangpiao.com/cinema/281/"
"1428","1-1428","北京市","110000","星美国际影城分钟寺店","北京市丰台区南三环东路成寿寺路2号新业广场2层 ","","电影院","250","39.86311","116.45366","5","0","null","","0","公交换乘：25 53 300 352 368 626 627 680 723 750 821 954 运通107均可到达。 乘坐地铁：5号线到刘家窑C、D出口换3","北京阳光星美国际影城位于南三环方庄桥东，新业广场二层。建筑面积3519平方米，拥有9个多功能放映厅，共有座位1102个，影城定位于超五星级主题影城，是一个集休闲．视听．娱乐．产品等多方面于一体的综合性多功能数字化影城；北京阳光星美国际影城不仅拥有世界上最先进的数字电影放映设备、浓厚的电影文化氛围，同时我们训练有素的员工将为您提供全方位的优质服务。它将成为北京乃至全国最好的一家影城，提供与国际接轨的全新影音享受。&nbsp;北京阳光星美国际影城的300多个停车位，让您的爱车也有自己的专席。&nbsp;[A%#][A%#][A%#]收费停车，新业广场可提供300多个停车位[A%#][A%#]仙踪林、必胜客、肯德基、正一味等[A%#][A%#][A%#]",,"http://img.wangpiao.com/NewsImage/20132/52a281e1-eae8-4554-ba77-6bcd4452eb1f.jpg","Http://www.wangpiao.com/cinema/103/"
"1421","1-1421","天津市","120000","天津瑞景横店影城","天津市北辰区龙泉道与辰昌路交口处（地铁1号线西横堤站旁）瑞景商业区B区3F ","","电影院","250","39.20664","117.12819","133","0","null","","0","46","天津瑞景横店电影城有限公司简介：&nbsp;天津瑞景横店电影城位于瑞景大酒店斜对面乐天玛特超市旁，由浙江横店影视娱乐有限公司投资兴建的一座五星级标准豪华多功能电影城，影城营业面积4700平方米，拥有7个标准厅包括1个豪华VIP厅，7个全数字厅，可放映3D电影。影城全部采用美国JBL功放和音响，英国DOLBY数字解码器，德国进口的高清晰放映镜头，英国哈尼克斯高反射率银幕。配合超宽可摇摆沙发座椅以及45度角阶梯设计，给您带来前所未有身临其境的视听震撼！&nbsp;横店影城热忱欢迎您的到来，我们将为您献上优质和最美的享受！[A%#][A%#][A%#][A%#][A%#][A%#][A%#][A%#]",,"http://img.wangpiao.com/NewsImage/20132/c79ac867-e2f0-4c66-9fec-0e6534547d57.jpg","Http://www.wangpiao.com/cinema/1485/"
"1422","1-1422","天津市","120000","美亚影城","天津市红桥区大丰路水游城B座5层 ","","电影院","250","39.15221","117.17590","132","0","null","","0","46","天津美亚影城是由香港美亚娱乐资讯集团有限公司斥资3000万元打造的五星级影城。该影城位于天津市红桥区大丰路水游城B座五层。建筑面积4000平方米,设置7个豪华影厅近1000余个座位。&nbsp;美亚影城不惜巨资引进美国一流的放映设备，全心全意为您呈现集视觉、听觉于一体的超高观影效果。我们将秉承优秀的运营、服务理念，为您营造一个舒适化的观影环境。这里有人性化的电脑售票系统，观众可以自主选择影片餐厅及座位牌号。这里也有多种饮料小吃的卖品部，让您挑选。这里还有处处充满微笑的服务员，为您提供无微不至的关怀。[A%#]Real D，金属银幕 [A%#][A%#][A%#]水游城[A%#]麦当劳，韩罗苑[A%#][A%#][A%#]",,"http://img.wangpiao.com/NewsImage/20132/5acb46e8-0ff7-48c1-841a-1bb57a1d45e4.jpg","Http://www.wangpiao.com/cinema/1486/"
"1459","1-1459","南京市","320100","17.5影城南京SHE影城","南京市建邺区庐山路158号（嘉业国际影城5栋3-15） ","","电影院","250","32.00527","118.73559","138","0","null","","0","26","影院设4个数字影厅，375座位，是南京地区第一家温馨社区化影院，让你告别百人以上观影的恶唑空气和相互干扰。影院届时会有派对活动专场，如单身派队，冰激凌派队等主题派对活动。&nbsp;影院采用目前市面上高品质的数字投影设备和屏幕，综合优化了色彩，亮度和对比度，从而呈现出了一流的画面，音响系统得到了卢卡斯影业认证的THX音效标准，如实还原影片声音效果。[A%#]2号厅和4号厅为3D影厅，2号厅88座，4号厅81座。 [A%#][A%#]嘉业国际城拥有大型地下停车库，停车费2元/小时。[A%#]乐潮汇ＫＴＶ[A%#]二楼；盛湘宴三楼：豪食汇四楼：魔锅坊香锅，膳庄菜馆，米乐餐饮五楼：真知味高端中餐和泰国料理[A%#][A%#][A%#]",,"http://img.wangpiao.com/NewsImage/20132/7185f567-562e-4348-8cb1-32fbd28c46a7.jpg","Http://www.wangpiao.com/cinema/1025/"
"1460","1-1460","南通市","320600","17.5影城南通曼都今典影城","南通市崇川区桃园路7号体育会展中心 ","","电影院","250","31.97274","120.90345","120","0","null","","0","301、22、41、35、13路","17.5南通曼度今典影城是苏中地区首家推出“1+X”模式的第三代影城。影城内共有5个放映厅，拥有5块专业放映银幕，可容纳500多人同时观影，并按照五星级影城标准的配套硬件设施建造。影城融合了北美的细腻和欧洲的大气，所有设计细节都充满科学性和人性化。影城采用全进口国际最先进的蒙太奇数码放映设备和音响系统，为电影消费者带来真正的顶级视听享受。置身于影厅之中，超大的整壁式清晰银幕以及全方位立体声波，将毫不留情的震撼您、冲击您所有的感官神经，感受非同一般的梦幻体验，给您前所未有的视听震撼，同时也树立了影音观赏理念。[A%#][A%#][A%#][A%#][A%#][A%#][A%#][A%#]",,"http://img.wangpiao.com/NewsImage/20132/9d5dc31f-1bde-408c-8407-520a83e5c4de.jpg","Http://www.wangpiao.com/cinema/1046/"
"1465","1-1465","天津市","120000","天津横店电影城麦购店","天津市和平区南马路11号麦购时代广场5楼 ","","电影院","250","39.14209","117.19276","29","0","null","","0","47","天津横店电影城麦购店位于和平区麦购时代广场五楼，由浙江横店影视娱乐有限公司投资兴建的一座五星级标准豪华多功能影城，影城营业面积2600平方米，拥有8个标准厅包括1个豪华VIP厅，8个全数字厅，可放映3D电影。影城全部采用美国JBL功放和音响，英国DOLBY数字解码器，德国进口的高清晰放映镜头，英国哈尼克斯高反射率银幕。影城各标准影厅均配有豪华舒适座椅以及45度角阶梯设计，VIP影厅另配奢华超宽可摇摆沙发座椅，为您带来前所未有身临其境的视听震撼！[A%#][A%#][A%#][A%#][A%#][A%#][A%#][A%#]",,"http://img.wangpiao.com/NewsImage/20132/dae3ceff-f9f2-4bcc-bcd6-cca3f89ac1f7.jpg","Http://www.wangpiao.com/cinema/1490/"
"1447","1-1447","北京市","110000","丰台青少年剧场","北京市丰台区西四环南路86号","","电影院","250","39.85789","116.29047","5","0","null","","0","乘公交699路、740路、937支线、937专线、604路、480路、特7、973路到正阳桥北站下车，步行即到4","北京市丰台青少年剧场地处繁华的西四环南路，它的前身是丰台影剧院。建筑面积4000多平方米。拥有四个放映厅，其中包括可容纳730人的大型影厅，96人中型影厅、72人小型影厅、36人豪华型影厅。影厅的灯光音响及各种控制和操作系统均属现代化硬件设施。其中730个座位的大型影厅和96人的中型影厅，配备数字立体声音响系统、高清晰数字放映机。[A%#][A%#][A%#]收费停车[A%#][A%#][A%#][A%#][A%#]",,"http://img.wangpiao.com/NewsImage/20132/359b72ad-bd6f-436c-a70e-ef813094757b.jpg","Http://www.wangpiao.com/cinema/1899/"
"1449","1-1449","北京市","110000","糖人街影院","北京市丰台区六里桥华源一街2号楼B1层","","电影院","250","39.88810","116.32327","5","0","null","","0","201、205、300、323、324、349、368、486、631、67、687、691、698华源一街下车","糖人街电影院为大家提供一个以看电影为主的幽静高雅的多元化休闲场所，希望能为丰富百姓文化娱乐生活，提高大众文化生活品位做出贡献，更希望这小小的场所能成为您和家人喜爱光顾的、高品质的、健康时尚的文化绿洲，影院有三个标准大银幕放映厅，设置宽松的排间距离，少量的座位数，确保您能舒适地欣赏影片。&nbsp;影院为大家提供一个以看电影为主的幽静高雅的多元化休闲场所。希望能为丰富百姓文化娱乐生活，提高大众文化生活品位做出贡献。更希望这小小的场所能成为您和家人喜爱光顾的、高品质的、健康时尚的文化绿洲。&nbsp;影院有三个标准大银幕放映厅。设置宽松的排间距离，少量的座位数，确保您能舒适地欣赏影片。影院内设有水吧消费区，为您营造了一个优雅的等映环境，同时销售多种观影必备的小食品和饮料。&nbsp;影院能为公司单位活动、家庭欢聚或朋友聚会提供包场放映服务。[A%#][A%#][A%#]地下停车场[A%#][A%#][A%#][A%#][A%#]",,"http://img.wangpiao.com/NewsImage/20132/a450e589-49b4-4431-ac50-216792e8d352.jpg","Http://www.wangpiao.com/cinema/1900/"
"1442","1-1442","西安市","610100","西安耀莱成龙国际影城","西安市曲江新区大唐不夜城银泰中心四层 ","","电影院","250","34.21430","108.97008","136","0","null","","0","","JACKIECHAN耀莱国际影城由国际巨星成龙先生与耀莱集团共同投资打造管理，选择最优质的设备、倡导以人为本的服务理念、宣传优秀电影，打造一个尽善尽美、体现五星级质感的影城，让电影人也让所有观众都能藉着这舞台获得完美的观影体验。&nbsp;西安耀莱成龙国际影城位于西安市大雁塔大唐不夜城银泰百货四楼，面积4500平方米，设有7个影厅(含VIP厅1个)，座位总数约为1470个。影院拥有专业管理团队、全新的经营理念、现代化全方位的管理，终极式服务，将以为西安市民提供一种全新文化新理念以及娱乐消费的尊贵享受。&nbsp;[A%#][A%#][A%#][A%#][A%#][A%#][A%#][A%#]",,"http://img.wangpiao.com/NewsImage/20132/fc00e825-3115-43cf-b410-1d234fa8923e.jpg","Http://www.wangpiao.com/cinema/1636/"
"1188","1-1188","北京市","110000","大料国际影城","北京市大兴区亦庄经济开发区文化园东路6号 ","","电影院","250","39.81847","116.51277","60","0","null","","0","亦庄线地铁文化园站东100米8","大料国际影城位于亦庄开发区的亦庄创意生活广场三层，是目前亦庄开发区的一家高级电影院。影城内设6个多功能影厅，包括2个3D影厅，1个VIP影厅，3个中型影厅，共1200多个座位。大料国际影城是集电影放映、大型会议、公司年会为一体的艺术平台。影城配备目前世界先进数字电影放映机?BARCO高清晰度数字放映机、QSC还音系统，倾力打造震撼完美的五星级视听享受！[A%#]无押金[A%#][A%#]收费停车场[A%#]嘉斯猫电玩城[A%#]肯德基、棒约翰等[A%#][A%#]周二半价[A%#]儿童不满1.2M的免票但是没有座位3D没有眼镜，且只能是一个大人带一个",,"http://img.wangpiao.com/NewsImage/20132/5ed98a7c-de4b-4a2d-8422-04bd22d452a5.jpg","Http://www.wangpiao.com/cinema/71/"
"1189","1-1189","北京市","110000","万达国际影城石景山店","北京市石景山区石景山路乙18号万达广场3层 ","","电影院","250","39.91162","116.23295","23","0","null","","0","地铁1号线八宝山站； 337、389、728、527、941老山站； 621、958、373、620、308、212焦家坟站1","由10个厅，1600余座位组成的北京万达国际电影城石景山店是由国内知名企业大连万达集团投巨资建立的超五星级标准电影城。&nbsp;北京万达国际电影城石景山店采用了代表当今电影工业最高技术的、国际上最先进的数码视听设备。这些高端科技的专业组合，将带给电影消费者前所未有的真正顶级的视听震撼，同时也树立了影音观赏理念的新标准。&nbsp;不仅设备一流，整个影城的设计及施工也是顶级的。影厅内，宽大舒适的沙发式座椅更是影院服务精神的亮点之一。全场的座椅以屏幕中心为圆心，45度角弧形排列面对屏幕，您无论在全场的任意座位都将得到完美的观赏。[A%#]无押金[A%#]8号厅IMAX厅有433个座位[A%#][A%#][A%#][A%#][A%#]普通观众周一至五12：00前半价优惠（含整点）[A%#]",,"http://img.wangpiao.com/NewsImage/20132/235301ea-ab76-45e4-85be-b4f7476a2afb.jpg","Http://www.wangpiao.com/cinema/67/"
"1167","1-1167","深圳市","440300","深圳嘉之华中心影城","深圳市中心区深圳音乐厅（福田区福中一路2016号） ","","电影院","250","22.55251","114.06421","20","0","null","","0","107路 123路 15路 232路 234路 235路 236路 374路 38路 398路 41路 60路 64路 B686路 E18路 K578路 N9路42","嘉之华中心影城位于优雅独特的深圳音乐厅内，紧邻市民中心，背靠莲花山，周边汇集深圳中心书城、深圳图书馆、电视中心、博物馆、关山月美术馆、少年宫等行政、文化、艺术为一体的城市中央，成为深圳不可复制的影城文化。&nbsp;嘉之华中心影城由代表着影像世界无线广袤和精彩的银河厅、九天厅、五洋厅、四海厅、子午厅五个影厅组成，共350个座位。整体影城间接、高雅、端庄的气质与音乐厅“黄红青白黑”建筑蕴含中国传统的五行理念相得益彰，体现出影城文化的独特韵味和艺术的氛围。[A%#][A%#][A%#][A%#]中心书城，图书馆，音乐厅[A%#]仙踪林，必胜客，肯德基，星巴克[A%#][A%#][A%#]",,"http://img.wangpiao.com/NewsImage/20132/e6a74086-7a90-4a97-89dc-087b9efce6cb.jpg","Http://www.wangpiao.com/cinema/1323/"
"1169","1-1169","仪征市","321081","仪征辉煌影院","仪征市市中区人民路36号（原仪征电影院） ","","电影院","250","32.27544","119.18804","899","0","null","","0","","仪征辉煌影院设置三个观众厅，一个多功能厅，座位数为500座。设备为先进的数字放映设备，其中一个为数字杜比3D厅。影院经过专家设计改造，全面装修一新，舒适的座椅，优雅的环境，热情周到细致的服务，全国同步的片源，期待您的光临！&nbsp;●&nbsp;杜比3D技术：图像分色技术质的飞跃&nbsp;大家知道，可见光的波长大约在390到770nm之间的区域内。我们在利用数字放映机放映画面时，数字放映机通过数字方式还原以红绿蓝三个颜色为基色的彩色图像。[A%#][A%#][A%#][A%#][A%#][A%#][A%#][A%#]",,"http://img.wangpiao.com/NewsImage/20132/4d9fe211-c1d8-4729-b407-98b57da845f8.jpg","Http://www.wangpiao.com/cinema/1756/"
